{
  "schema": "kipple.profile/v1",
  "name": "nightly",
  "created": 1793000000,
  "policy_version": 1,
  "held": [
    {
      "kind": "keep",
      "path": "/home/u/p9"
    }
  ],
  "entries": [
    {
      "rule": "builtin.cargo.target",
      "scope": "included",
      "rule_digest": "2c26b46b68ffc68ff99b453c1d304134",
      "integration_digest": "fcde2b2edba56bf408601fb721fe9b5c",
      "enabled": "enabled",
      "level": "balanced",
      "recent_days": 7,
      "method": "delete",
      "roots": [
        {
          "root": "config.project-roots",
          "path": "/home/u",
          "identity": "7:3"
        }
      ]
    },
    {
      "rule": "builtin.node.modules",
      "scope": "left-out",
      "rule_digest": "baa5a0964d3320fbc0c6a922140453c8",
      "integration_digest": "fcde2b2edba56bf408601fb721fe9b5c",
      "enabled": "disabled",
      "level": "careful",
      "recent_days": 30,
      "method": "trash",
      "roots": [
        {
          "root": "config.project-roots",
          "path": "/home/u",
          "identity": null
        }
      ]
    }
  ]
}
